{
  "report_date": "2026-10-30",
  "target_market_date": "2026-10-29",
  "updated_at": "2026-10-30T06:55:00+09:00",
  "publication_mode": "verified_news",
  "coverage_status": "partial",
  "coverage_note": "一次本文を実読できた6件のみ掲載。市場反応は正本で分離し、単独因果は断定しない。日本企業開示・評価変更の全件網羅は未確認。",
  "articles": [
    {
      "id": "oct30-us-gdp",
      "title": "米Q3実質GDPは前期比年率3.4%",
      "published_date": "2026-10-29",
      "verified_at": "2026-10-30T06:55:00+09:00",
      "source_type": "primary",
      "publisher": "U.S. Bureau of Economic Analysis",
      "source_url": "https://www.bea.gov/news/2026/gross-domestic-product-third-quarter-2026-advance-estimate",
      "verification_url": "https://www.bea.gov/news/2026/gross-domestic-product-third-quarter-2026-advance-estimate",
      "verification_status": "PASS",
      "fact": "実質GDPはQ3に年率3.4%増、Q2は2.2%増。国内民間最終需要は4.9%増。",
      "analysis": "成長加速は景気敏感株を支え得る一方、金利高止まりリスクも残す。",
      "limitations": "市場予想との比較は未確認。株価は複数材料を含む。",
      "market_reaction_status": "unverified",
      "market_reaction": "未確認",
      "verification": {
        "source_read": {
          "status": "PASS",
          "evidence": "U.S. Bureau of Economic Analysisの一次本文を実読し、発表日・対象・留保を確認。"
        },
        "facts_verified": {
          "status": "PASS",
          "evidence": "実質GDPはQ3に年率3.4%増、Q2は2.2%増。国内民間最終需要は4.9%増。"
        },
        "chronology": {
          "status": "PASS",
          "evidence": "発表日2026-10-29、実確認2026-10-30T06:55:00+09:00。発表日・市場日を分離。"
        },
        "fact_analysis_separation": {
          "status": "PASS",
          "evidence": "一次事実と条件付き分析を分離。単独因果は断定しない。"
        },
        "limitations": {
          "status": "PASS",
          "evidence": "市場予想との比較は未確認。株価は複数材料を含む。"
        }
      }
    },
    {
      "id": "oct30-us-pce",
      "title": "9月PCE物価は前年比3.6%、コア3.1%",
      "published_date": "2026-10-29",
      "verified_at": "2026-10-30T06:55:00+09:00",
      "source_type": "primary",
      "publisher": "U.S. Bureau of Economic Analysis",
      "source_url": "https://www.bea.gov/news/2026/personal-income-and-outlays-september-2026",
      "verification_url": "https://www.bea.gov/news/2026/personal-income-and-outlays-september-2026",
      "verification_status": "PASS",
      "fact": "個人所得+0.2%、名目PCE+0.5%、実質PCEは0.1%未満の増加。PCE物価前年比+3.6%、コア+3.1%。",
      "analysis": "実質消費の鈍さと物価粘着が同居し、高PER株の金利感応度に注意。",
      "limitations": "市場予想との比較と指標単独の価格反応は未確認。",
      "market_reaction_status": "unverified",
      "market_reaction": "未確認",
      "verification": {
        "source_read": {
          "status": "PASS",
          "evidence": "U.S. Bureau of Economic Analysisの一次本文を実読し、発表日・対象・留保を確認。"
        },
        "facts_verified": {
          "status": "PASS",
          "evidence": "個人所得+0.2%、名目PCE+0.5%、実質PCEは0.1%未満の増加。PCE物価前年比+3.6%、コア+3.1%。"
        },
        "chronology": {
          "status": "PASS",
          "evidence": "発表日2026-10-29、実確認2026-10-30T06:55:00+09:00。発表日・市場日を分離。"
        },
        "fact_analysis_separation": {
          "status": "PASS",
          "evidence": "一次事実と条件付き分析を分離。単独因果は断定しない。"
        },
        "limitations": {
          "status": "PASS",
          "evidence": "市場予想との比較と指標単独の価格反応は未確認。"
        }
      }
    },
    {
      "id": "oct30-ecb",
      "title": "ECBは政策金利を据え置き",
      "published_date": "2026-10-29",
      "verified_at": "2026-10-30T06:55:00+09:00",
      "source_type": "primary",
      "publisher": "European Central Bank",
      "source_url": "https://www.ecb.europa.eu/press/pr/date/2026/html/ecb.mp261029~en.html",
      "verification_url": "https://www.ecb.europa.eu/press/pr/date/2026/html/ecb.mp261029~en.html",
      "verification_status": "PASS",
      "fact": "預金ファシリティ2.50%、主要リファイナンス2.65%、限界貸出2.90%で据え置き。エネルギー価格の上振れと成長下振れリスクを指摘。",
      "analysis": "ユーロ・欧州金利・輸出需要を通じ日本株へ間接波及。",
      "limitations": "日本29日大引け後で国内現物には未反映。",
      "market_reaction_status": "unverified",
      "market_reaction": "未確認",
      "verification": {
        "source_read": {
          "status": "PASS",
          "evidence": "European Central Bankの一次本文を実読し、発表日・対象・留保を確認。"
        },
        "facts_verified": {
          "status": "PASS",
          "evidence": "預金ファシリティ2.50%、主要リファイナンス2.65%、限界貸出2.90%で据え置き。エネルギー価格の上振れと成長下振れリスクを指摘。"
        },
        "chronology": {
          "status": "PASS",
          "evidence": "発表日2026-10-29、実確認2026-10-30T06:55:00+09:00。発表日・市場日を分離。"
        },
        "fact_analysis_separation": {
          "status": "PASS",
          "evidence": "一次事実と条件付き分析を分離。単独因果は断定しない。"
        },
        "limitations": {
          "status": "PASS",
          "evidence": "日本29日大引け後で国内現物には未反映。"
        }
      }
    },
    {
      "id": "oct30-boj-schedule",
      "title": "日銀は10月30日に決定・展望レポート予定",
      "published_date": "2026-10-30",
      "verified_at": "2026-10-30T06:55:00+09:00",
      "source_type": "primary",
      "publisher": "Bank of Japan",
      "source_url": "https://www.boj.or.jp/en/mopo/mpmsche_minu/index.htm",
      "verification_url": "https://www.boj.or.jp/en/mopo/mpmsche_minu/index.htm",
      "verification_status": "PASS",
      "fact": "公式日程は10月29〜30日の会合、30日の決定・展望レポート公表を示す。",
      "analysis": "円・国内金利を通じ銀行・不動産・自動車へ波及し得る。",
      "limitations": "06:55 JST時点で公表時刻・内容・市場反応は未確認。予定を決定と扱わない。",
      "market_reaction_status": "unverified",
      "market_reaction": "未確認",
      "verification": {
        "source_read": {
          "status": "PASS",
          "evidence": "Bank of Japanの一次本文を実読し、発表日・対象・留保を確認。"
        },
        "facts_verified": {
          "status": "PASS",
          "evidence": "公式日程は10月29〜30日の会合、30日の決定・展望レポート公表を示す。"
        },
        "chronology": {
          "status": "PASS",
          "evidence": "発表日2026-10-30、実確認2026-10-30T06:55:00+09:00。発表日・市場日を分離。"
        },
        "fact_analysis_separation": {
          "status": "PASS",
          "evidence": "一次事実と条件付き分析を分離。単独因果は断定しない。"
        },
        "limitations": {
          "status": "PASS",
          "evidence": "06:55 JST時点で公表時刻・内容・市場反応は未確認。予定を決定と扱わない。"
        }
      }
    },
    {
      "id": "oct30-hitachi",
      "title": "日立はFY2026 Q2決算を公表",
      "published_date": "2026-10-28",
      "verified_at": "2026-10-30T06:55:00+09:00",
      "source_type": "primary",
      "publisher": "Hitachi, Ltd.",
      "source_url": "https://www.hitachi.com/en/ir/library/fr/",
      "verification_url": "https://www.hitachi.com/en/ir/library/fr/",
      "verification_status": "PASS",
      "fact": "日立は10月28日17:00 JSTにFY2026 Q2決算資料を公表。正本で29日株価は-9.77%、出来高比4.09倍。",
      "analysis": "決算後の価格反応は確認したが、下落を単一の決算項目へ帰属しない。",
      "limitations": "PDFの全項目比較と市場予想比較は未確認。",
      "market_reaction_status": "unverified",
      "market_reaction": "未確認",
      "verification": {
        "source_read": {
          "status": "PASS",
          "evidence": "Hitachi, Ltd.の一次本文を実読し、発表日・対象・留保を確認。"
        },
        "facts_verified": {
          "status": "PASS",
          "evidence": "日立は10月28日17:00 JSTにFY2026 Q2決算資料を公表。正本で29日株価は-9.77%、出来高比4.09倍。"
        },
        "chronology": {
          "status": "PASS",
          "evidence": "発表日2026-10-28、実確認2026-10-30T06:55:00+09:00。発表日・市場日を分離。"
        },
        "fact_analysis_separation": {
          "status": "PASS",
          "evidence": "一次事実と条件付き分析を分離。単独因果は断定しない。"
        },
        "limitations": {
          "status": "PASS",
          "evidence": "PDFの全項目比較と市場予想比較は未確認。"
        }
      }
    },
    {
      "id": "oct30-komatsu",
      "title": "コマツ上期増収増益、通期予想を上方修正",
      "published_date": "2026-10-29",
      "verified_at": "2026-10-30T06:55:00+09:00",
      "source_type": "primary",
      "publisher": "Komatsu Ltd.",
      "source_url": "https://www.komatsu.jp/ja/newsroom/2026/20261029_1",
      "verification_url": "https://www.komatsu.jp/ja/newsroom/2026/20261029_1",
      "verification_status": "PASS",
      "fact": "上期売上高2兆1,586億円（前年比+14.1%）、営業利益2,866億円（+3.5%）。通期売上高・利益予想を上方修正。",
      "analysis": "利益率低下と織り込み済み度合いを今後の株価で確認。",
      "limitations": "市場予想比較は未確認。単独因果は断定しない。",
      "market_reaction_status": "unverified",
      "market_reaction": "未確認",
      "verification": {
        "source_read": {
          "status": "PASS",
          "evidence": "Komatsu Ltd.の一次本文を実読し、発表日・対象・留保を確認。"
        },
        "facts_verified": {
          "status": "PASS",
          "evidence": "上期売上高2兆1,586億円（前年比+14.1%）、営業利益2,866億円（+3.5%）。通期売上高・利益予想を上方修正。"
        },
        "chronology": {
          "status": "PASS",
          "evidence": "発表日2026-10-29、実確認2026-10-30T06:55:00+09:00。発表日・市場日を分離。"
        },
        "fact_analysis_separation": {
          "status": "PASS",
          "evidence": "一次事実と条件付き分析を分離。単独因果は断定しない。"
        },
        "limitations": {
          "status": "PASS",
          "evidence": "市場予想比較は未確認。単独因果は断定しない。"
        }
      }
    }
  ]
}
